"rating","text","ts","bot_percentage","profileimage"
"0.06818181818181818","How New England Patriots player Julian Edelman helped stop a potential school shooting https://t.co/uugxP0aBjE https://t.co/8XhC277T58","1522918395.0","",""
"0.0","A month after the poisoning in the British town of Salisbury, the UK and Russia remain locked in battle over who to… https://t.co/HRwEzVIUu1","1522917988.0","",""
"0.0","TVs. Dishwashers. Printers. These are just some of the products that could get more expensive if the United States… https://t.co/HlXZ5En5wM","1522917382.0","",""
"0.18571428571428572","Exclusive: In an unusual step, special counsel Robert Mueller’s team is questioning Russian oligarchs who traveled… https://t.co/xjgxAGv9RG","1522916949.0","",""
"0.1","How China gets what it wants from American companies https://t.co/tp0tWHUr24 https://t.co/SJcu0zjvTr","1522916586.0","",""
"0.0","JPMorgan Chase CEO Jamie Dimon: ""We need to resolve immigration — it is tearing apart our body politic and damaging… https://t.co/TgCJizCcSZ","1522916005.0","",""
"0.3","Shortly after Facebook announced stricter rules for its third-party developers, popular dating app Tinder stopped w… https://t.co/gnvvTtGbUK","1522915679.0","",""
"0.0","RT @NewDay: #FactsFirst: Alisyn Camerota has the border battle by the numbers. \n\nhttps://t.co/33JKV6dzXU https://t.co/bvaGEVfILv","1522915619.0","",""
"-0.14999999999999997","""I will gladly work with the President when his ideas aren't stupid and detrimental to the United States,"" says Rep… https://t.co/9wrE9MNhnw","1522915234.0","",""
"-0.2","Facebook says that Cambridge Analytica, a data firm with ties to President Donald Trump's campaign, may have had in… https://t.co/etcjriwvUT","1522914687.0","",""
"0.0","FDA chief: Opioids are the ""biggest crisis facing the FDA"" https://t.co/C4E4oDvLbX https://t.co/Oi2EZVvibq","1522914018.0","",""
"-0.5","Bollywood superstar Salman Khan could face prison time after being convicted of illegal poaching in a decades-old c… https://t.co/9T7PhPMgg4","1522913942.0","",""
"0.0","""For whatever reasons... you've got Trump basically parroting what Putin says."" Hillary Clinton slams President Tru… https://t.co/55zJdSIN92","1522913395.0","",""
"0.0","Planning a summer holiday to Boracay? Think again. https://t.co/uyvyG2tGZT","1522912910.0","",""
"0.3333333333333333","A Carl's Jr. employee was quick to act when a woman wounded in the YouTube shooting was helped into the fast-food r… https://t.co/3kHAcTVLD6","1522912503.0","",""
"0.2","Exclusive: A lawyer who cut deals for a porn star and Playmate over their alleged sexual encounters with Trump says… https://t.co/DGxJ2VLTX0","1522912116.0","",""
"0.0","RT @NewDay: ""That's a Mussolini tactic, not an American tactic"" says former Treasury Secretary Larry Summers on Trump's attacks on Amazon.…","1522912094.0","",""
"0.0","The companies Trump has attacked on Twitter since his election:\n\nABC News\nAmazon\nBoeing\nCBS\nCNN\nComcast/MSNBC/NBC\nD… https://t.co/oJtxCWczmj","1522911605.0","",""
"0.25","Stevie Wonder has joined Twitter and his first tweet did not disappoint. https://t.co/XzYVu1OcOn","1522911359.0","",""
"0.0","The YouTube shooter visited a gun range before the attack, police say https://t.co/hpfGr9U5BG","1522910975.0","",""
"0.25","Stevie Wonder has joined Twitter and his first tweet did not disappoint. https://t.co/CeLvPVnQ1W https://t.co/y0K3Oe5ROj","1522910406.0","",""
"0.0","The number of migrants trying to illegally cross into the US at the Mexico border spiked dramatically in March, acc… https://t.co/YvJhy68gUm","1522909810.0","",""
"0.0","The caravan of Central American migrants going through Mexico to the US border is not ending. Some will stay in Mex… https://t.co/rtDFn4vblS","1522909204.0","",""
"0.0","A resolution condemning neo-Nazis and white nationalists has died a second time in the Tennessee legislature this w… https://t.co/eDmw4aakNi","1522908608.0","",""
"0.1","RT @NewDay: Jennifer Granholm says EPA chief Scott Pruitt is getting ""too big for his britches"": He ""wants to be President and this issue o…","1522908520.0","",""
"0.0","5 things for Thursday:\n\n- Mexican border\n- YouTube shooting\n- Facebook\n- Russia investigation\n- Teacher protests… https://t.co/3WzJS00vY8","1522908006.0","",""
"0.5","The woman who became internet famous in October for flipping the bird at President Donald Trump's motorcade, and th… https://t.co/YL4y6xWp3Q","1522907436.0","",""
"0.0","A morning TV producer at a Sinclair-owned station in Nebraska has resigned in protest of what he calls the company'… https://t.co/u2uZjLuzqO","1522906734.0","",""
"0.0","Planned Parenthood President Cecile Richards says she felt bribed by Ivanka Trump and Jared Kushner, claiming they… https://t.co/5Z96Sbxco1","1522905996.0","",""
"0.0","A sterilization breach at a Denver hospital may have put patients at risk for infection of HIV, hepatitis B or hepa… https://t.co/cZrc7VnxD7","1522905338.0","",""
"0.6","A lawsuit alleges that a fertility doctor used his own sperm to inseminate his patient. A woman discovered through… https://t.co/9gB8peVTaF","1522905305.0","",""
"-0.07676767676767678","New York City police officers shot and killed a black man after he pointed what they believed was a gun at them, bu… https://t.co/nMylCSKU6o","1522904603.0","",""
"-0.125","Why trainloads of other people's poo have been rotting in an Alabama town for months https://t.co/uirq5ayFjb https://t.co/Cs3meW0vUC","1522903983.0","",""
"0.0","When an Oklahoma teacher revealed what the chairs in her classroom look like, she didn't imagine it would drive peo… https://t.co/yeD1V6LmK6","1522903278.0","",""
"-0.1","Without immigration, our economy is in big trouble | By Dennis E. Nixon via @CNNOpinion https://t.co/vy9dRiqEmS https://t.co/gkb7rtc5kv","1522902547.0","",""
"0.0","When an Oklahoma teacher revealed what the chairs in her classroom look like, she didn't imagine it would drive peo… https://t.co/HYalV3LmVF","1522899079.0","",""
"-0.5","Bollywood superstar Salman Khan could face prison time after being convicted of illegal poaching in a decades-old c… https://t.co/7op8RRx5so","1522896967.0","",""
"-0.15555555555555559","The Bible appears to have been removed from online marketplaces in China, as Beijing clamps down on how its citizen… https://t.co/DdlRr8SzRo","1522896005.0","",""
"0.1708333333333333","The extraordinary story of a married Chinese couple reuniting with their daughter nearly 24 years after she went mi… https://t.co/QPr8AuuOzg","1522895313.0","",""
"-0.2","Facebook says that Cambridge Analytica, a data firm with ties to President Donald Trump's campaign, may have had in… https://t.co/dQPuMjBaxw","1522894927.0","",""
"0.0","It was a night to forget for Manchester City, who also had their team bus attacked by Liverpool FC fans before the… https://t.co/HpGDfFJTLc","1522894570.0","",""
"0.0","Australia launches investigation into Facebook over data scandal https://t.co/B3GG8JPYCp https://t.co/1L0QV0fe4N","1522893547.0","",""
"0.25","Stevie Wonder has joined Twitter and his first tweet did not disappoint. https://t.co/fD0uXvmztj","1522892585.0","",""
"0.25","Dwayne ""The Rock"" Johnson is still interested in running for US president -- just maybe not in 2020… https://t.co/gcz80UpUHq","1522891939.0","",""
"-0.6","Artificial intelligence scientists from around the world called for a boycott of a South Korean university over con… https://t.co/EyuJx8wYkg","1522891021.0","",""
"0.0","A month after the poisoning in the British town of Salisbury, the UK and Russia remain locked in battle over who to… https://t.co/7lYWRHpL7Y","1522890722.0","",""
"0.5","The woman who became internet famous in October for flipping the bird at President Donald Trump's motorcade, and th… https://t.co/X70HLiRFoX","1522890066.0","",""
"0.0","There's a growing trend of out-of-the-blue policy edicts issued by an increasingly imperious President, who has app… https://t.co/S3wzVhfR6V","1522889868.0","",""
"0.0625","Amazon is not the first business to end up in President Trump's crosshairs. Here are 16 other companies the Preside… https://t.co/PxxMNMHoug","1522889166.0","",""
